{
  "schema": "hermternal.fixture-index.v1",
  "contract": "dashboard-v0.0.1",
  "hermes_source_sha": "f5be9236e00ddf2f2a412697f267078fc4ee068e",
  "synthetic_only": true,
  "live_claim": false,
  "evidence_status": "partial",
  "fixture_roots": [
    {
      "id": "attachment-policy",
      "path": "attachment-policy",
      "status": "ready",
      "contract": "dashboard-v0.0.1",
      "hermes_source_sha": "f5be9236e00ddf2f2a412697f267078fc4ee068e",
      "synthetic_only": true,
      "live_claim": false,
      "platforms": [
        "web",
        "ios",
        "ipados",
        "macos"
      ],
      "states": [
        "empty",
        "failure",
        "success"
      ],
      "coverage_ids": [
        "images-only-attachments"
      ],
      "validator": "validate.py",
      "files": [
        {
          "path": "attachment-policy/README.md",
          "sha256": "350d05a20260ea384575d9c9508246d23a2bbfdd1f0dd1e8834c56afd93a3730",
          "size_bytes": 10377
        },
        {
          "path": "attachment-policy/cases.json",
          "sha256": "1329316d990026ff00e1285cfc4c9516cba183af96505f4e4ac5a2b5cbd16e68",
          "size_bytes": 31110
        },
        {
          "path": "attachment-policy/test_attachment_policy.py",
          "sha256": "ac532286699a8db1747a8fb2cade5e482a894289a8b51cec70ffbbdb672a6b22",
          "size_bytes": 29711
        },
        {
          "path": "attachment-policy/validate.py",
          "sha256": "5257fcdcd94b031a9f89e77f7b97e70936b22787f97efa5eaba563d30a7d3552",
          "size_bytes": 48788
        }
      ]
    },
    {
      "id": "behavioral-probe",
      "path": "behavioral-probe",
      "status": "ready",
      "contract": "dashboard-v0.0.1",
      "hermes_source_sha": "f5be9236e00ddf2f2a412697f267078fc4ee068e",
      "synthetic_only": true,
      "live_claim": false,
      "platforms": [
        "web",
        "ios",
        "ipados",
        "macos"
      ],
      "states": [
        "cancelled",
        "empty",
        "failure",
        "pending",
        "success",
        "unknown"
      ],
      "coverage_ids": [
        "behavioral-probe",
        "malformed-json-redaction"
      ],
      "validator": "validate.py",
      "files": [
        {
          "path": "behavioral-probe/README.md",
          "sha256": "875b83f523c7ec4ff8e6c28e542f80ae734a73f79118bd27b1294f444b7e8dc9",
          "size_bytes": 9387
        },
        {
          "path": "behavioral-probe/baseline-canonical-sha256.txt",
          "sha256": "3d94e162c619d18772ce3c3b08bf6ffb1e3b41c50a4494f409a17c468acb70b3",
          "size_bytes": 65
        },
        {
          "path": "behavioral-probe/probe-baseline.json",
          "sha256": "4c9c88f807babe7c010d9127fa13ded7ca3be5abef56009d07ed5092de837be6",
          "size_bytes": 4059
        },
        {
          "path": "behavioral-probe/probe-fixtures.json",
          "sha256": "9958c4c3f32946e7301fdffa5a861b36f7921ada8b394ea72e07405b7c1d3fef",
          "size_bytes": 71389
        },
        {
          "path": "behavioral-probe/test_validate.py",
          "sha256": "1a859e6afbe283e7736d24e980daca1d76513e1c603683afbb19903bd4bb795c",
          "size_bytes": 25252
        },
        {
          "path": "behavioral-probe/validate.py",
          "sha256": "aa426279c5844475af765b45990e55c519c1814ee98c1f445ac65f981550f75d",
          "size_bytes": 54195
        }
      ]
    },
    {
      "id": "chat-stream-completion",
      "path": "chat-stream-completion",
      "status": "ready",
      "contract": "dashboard-v0.0.1",
      "hermes_source_sha": "f5be9236e00ddf2f2a412697f267078fc4ee068e",
      "synthetic_only": true,
      "live_claim": false,
      "platforms": [
        "web",
        "ios",
        "ipados",
        "macos"
      ],
      "states": [
        "cancelled",
        "empty",
        "failure",
        "pending",
        "success",
        "unknown"
      ],
      "coverage_ids": [
        "chat-stream-and-completion"
      ],
      "validator": "validate.py",
      "files": [
        {
          "path": "chat-stream-completion/README.md",
          "sha256": "e35db6fb2d0b53eb770710105fe24dbd408927b12d93509dc258e4de1789e437",
          "size_bytes": 5484
        },
        {
          "path": "chat-stream-completion/cases.json",
          "sha256": "7b19df2b8ad000f94f7521da12f30a0d013683f799244c470ae539cea8cae384",
          "size_bytes": 29766
        },
        {
          "path": "chat-stream-completion/source-audit.json",
          "sha256": "a4722049299599c6fefb42047d05f0304eeccc473d6066bb3d0492e8d2c7ff61",
          "size_bytes": 2719
        },
        {
          "path": "chat-stream-completion/test_validate.py",
          "sha256": "f208b898fd0f9ec114ef0c65931acefbd73262635d20922983dbe6ea2ffed06c",
          "size_bytes": 17416
        },
        {
          "path": "chat-stream-completion/validate.py",
          "sha256": "b6ec003a3b961b33b1141d16ec7aa1c80cf5e2ac70924413b900474e596b8014",
          "size_bytes": 26635
        },
        {
          "path": "chat-stream-completion/validation-baseline.json",
          "sha256": "77c6d8cc88489809855c61a54becc9158764ebd73d8bf42c62356bfbc4c7723b",
          "size_bytes": 2747
        }
      ]
    },
    {
      "id": "compatibility-attestation",
      "path": "compatibility-attestation",
      "status": "ready",
      "contract": "dashboard-v0.0.1",
      "hermes_source_sha": "f5be9236e00ddf2f2a412697f267078fc4ee068e",
      "synthetic_only": true,
      "live_claim": false,
      "platforms": [
        "web",
        "ios",
        "ipados",
        "macos"
      ],
      "states": [
        "failure",
        "success"
      ],
      "coverage_ids": [
        "deployment-attestation"
      ],
      "validator": "validate.py",
      "files": [
        {
          "path": "compatibility-attestation/README.md",
          "sha256": "6d02a502dfc22bd1c50f6adbd5f6dde65f5824bc5be8f53dc7f5144d785ac950",
          "size_bytes": 7537
        },
        {
          "path": "compatibility-attestation/cases.json",
          "sha256": "bdac588896e47eb62e3292e2ab284a1b6cef0916e9e5ed83bafe28cc5de763c4",
          "size_bytes": 7447
        },
        {
          "path": "compatibility-attestation/revision_attestation.json",
          "sha256": "bf8288a9b3da55197568de51d839040887094a6be1bda2424d36f68c1aabd40f",
          "size_bytes": 1679
        },
        {
          "path": "compatibility-attestation/test_validate.py",
          "sha256": "aab4a96742d284b04bc22db65f9b812d71f5e78195b39754300ab88bdf99f5f9",
          "size_bytes": 23419
        },
        {
          "path": "compatibility-attestation/validate.py",
          "sha256": "5fbf6535f9b06c8140c957ef11dadef9c176a451f0894c051d7586e4d319ba5d",
          "size_bytes": 45624
        },
        {
          "path": "compatibility-attestation/validation-baseline.json",
          "sha256": "f6d506b2752b6751d45bc8439eb4625d2b18d9e58422013bb97193639378a964",
          "size_bytes": 1558
        }
      ]
    },
    {
      "id": "connection-restoration",
      "path": "connection-restoration",
      "status": "ready",
      "contract": "dashboard-v0.0.1",
      "hermes_source_sha": "f5be9236e00ddf2f2a412697f267078fc4ee068e",
      "synthetic_only": true,
      "live_claim": false,
      "platforms": [
        "web",
        "ios",
        "ipados",
        "macos"
      ],
      "states": [
        "cancelled",
        "failure",
        "pending",
        "success",
        "unknown"
      ],
      "coverage_ids": [
        "connection-restoration"
      ],
      "validator": "validate.py",
      "files": [
        {
          "path": "connection-restoration/README.md",
          "sha256": "db1b594257ee756d746e6771ccc5bd7877255c5b86759bb1510c70ecd5b6499e",
          "size_bytes": 6686
        },
        {
          "path": "connection-restoration/cases.json",
          "sha256": "91b43223a17ebaf309f0f57b32f804dc9bab28af4d6860cae33dae9a7bb03935",
          "size_bytes": 68422
        },
        {
          "path": "connection-restoration/test_validate.py",
          "sha256": "7c0350ae46a29879db092cd6476f70926ab69546b9806689d7f9406b5ab84627",
          "size_bytes": 17710
        },
        {
          "path": "connection-restoration/validate.py",
          "sha256": "42dbaa3c1b2332cd67a990732a4e18170d361387a4db2552c427f12d38fe3181",
          "size_bytes": 52948
        },
        {
          "path": "connection-restoration/validation-baseline.json",
          "sha256": "9f9b31e78de72149da2db5f634e7ac03467cb419d6dac7f67bdb862b4bc8a73b",
          "size_bytes": 2601
        }
      ]
    },
    {
      "id": "deep-link-grammar",
      "path": "deep-link-grammar",
      "status": "ready",
      "contract": "dashboard-v0.0.1",
      "hermes_source_sha": "f5be9236e00ddf2f2a412697f267078fc4ee068e",
      "synthetic_only": true,
      "live_claim": false,
      "platforms": [
        "web",
        "ios",
        "ipados",
        "macos"
      ],
      "states": [
        "failure",
        "success"
      ],
      "coverage_ids": [
        "private-deep-link"
      ],
      "validator": "validate.py",
      "files": [
        {
          "path": "deep-link-grammar/README.md",
          "sha256": "398f6fb1d339ed6289ae0f2dc57d861a8886b2598eedbefe6f8e0204cc925cb3",
          "size_bytes": 7384
        },
        {
          "path": "deep-link-grammar/cases.json",
          "sha256": "91fad69ec110ea8042678b963076056b4474072d24f9698067ed8bfc10c03d96",
          "size_bytes": 12925
        },
        {
          "path": "deep-link-grammar/test_validate.py",
          "sha256": "d6dca76d3483b00858f559cd59eabd97b0341e0f5205bc8b067fbecd5ce3d385",
          "size_bytes": 12970
        },
        {
          "path": "deep-link-grammar/validate.py",
          "sha256": "c01cc7958ebd573fa336d72de551e9c4b45e27397c6a38f5012eff35edff314e",
          "size_bytes": 32925
        }
      ]
    },
    {
      "id": "deep-link-resolution",